page_title	page_url	video_url	balinese	english	indonesian
Kapoles	https://dictionary.basabali.org/Kapoles	https://www.youtube.com/embed/dFeR8zWB6ac?	Lengis uruté kapoles tekén mémé di bangkiangné.	The massage oil is smeared by the mother at her waist.	Minyak urut itu dioles oleh ibu di pinggangnya.
Kapolesang	https://dictionary.basabali.org/Kapolesang	https://www.youtube.com/embed/FXcTCbTtbWk?	Satondén matunu, bé siapé kapolésang aji basa lan kécap.	Before baking, the chicken meat is spread with seasoning and soy sauce.	Sebelum dipanggang, daging ayam itu dioleskan bumbu dan kecap.
Kapolpolin	https://dictionary.basabali.org/Kapolpolin	https://www.youtube.com/embed/zWijkuWMk6o?	Batisné kapolpolin aji boréh apang tis.	His feet added with ‘param’ thickly to make it feel cool.	Kakinya dilepa menggunakan param agar terasa sejuk.
Kapondokin	https://dictionary.basabali.org/Kapondokin	https://www.youtube.com/embed/Zjm15NDYV7A?	Abianné kapondokin tekén bapa ulian tabiane sai palinga.	The garden was guarded by the father because the chili was often stolen.	Kebun itu dijaga oleh ayah karena cabainya sering dicuri.
Kapondong	https://dictionary.basabali.org/Kapondong	https://www.youtube.com/embed/SoK-kEAgHFU?	Seméné kapondong tekén buruhé ka toko.	The cement was carried by workers on their backs to the shop.	Semen itu dipikul di atas punggung oleh pekerja ke toko.
Kapondongin	https://dictionary.basabali.org/Kapondongin	https://www.youtube.com/embed/rfkdUse7_F0?	Tunduné kapondongin baan bias akampil.	His back is loaded with a sack of sand.	Punggungnya diberi beban sekarung pasir.
Kapongahang	https://dictionary.basabali.org/Kapongahang	https://www.youtube.com/embed/14B-6UtlEzc?	Jaman jani yén tusing kapongahang awaké, jog tusing maan apa.	Now if you don't dare and shameless, you won't get anything.	Jaman sekarang jika tidak memberanikan diri, tidak akan mendapat apa.
Kapongkod	https://dictionary.basabali.org/Kapongkod	https://www.youtube.com/embed/Bfm1gG3_7sU?	Punyan pohé kapongkod tekén Ketut.	The mango tree was climbed by Ketut.	Pohon mangga itu dipanjat oleh Ketut.
Kapongor	https://dictionary.basabali.org/Kapongor	https://www.youtube.com/embed/nz0M4Fa0_Lk?	Ipun kapongor olih Ida santukan ipun misuna okan idané.	He was wrathed by him because he slandered his son.	Dia dimurkai oleh beliau karena dia memfitnah anak beliau.
Kapongpong	https://dictionary.basabali.org/Kapongpong	https://www.youtube.com/embed/Ywa8DL1xuK4?	Kayuné kapongpong baan tetaniné .	The wood is made a hole by termites.	Kayu itu dilubangi oleh rayap.
Kapongpongang	https://dictionary.basabali.org/Kapongpongang	https://www.youtube.com/embed/te6Opa7nRcs?	Tembok baléné kapongpongang abedik apang tusing ongkeb.	The wall of the building was made a little hole so as not to heat.	Tembok bangunan itu dibuatkan sedikit lubang agar tidak panas.
Kapongpongin	https://dictionary.basabali.org/Kapongpongin	https://www.youtube.com/embed/Vv-rzZ6jXSE?	Kursiné kapongpongin baan tetaniné kanti uug.	The chair was made into a hole by termites until it was destroyed.	Kursi itu dilubangi oleh rayap hingga hancur.
Kaporod	https://dictionary.basabali.org/Kaporod	https://www.youtube.com/embed/T8THeddI44g?	Témbok punika kaporod olih ida rikalaning makta motor.	The wall was hit by him while riding a motorcycle.	Tembok itu diserempet oleh beliau ketika mengendari motor.
Kaporodang	https://dictionary.basabali.org/Kaporodang	https://www.youtube.com/embed/EjWB1dNqi4g?	Montor tiangé kaporodang tekén adin tiangé kanti usak.	My motorbike was crahsed by my brother until it was broken.	Motor saya diserempetkan oleh adik saya hingga rusak.
Kaporot	https://dictionary.basabali.org/Kaporot	https://www.youtube.com/embed/lrRMp0qgr8o?	Limané matatu ulian kaporot baan tali mangan.	His hand was injured because he was crushed with a sharp rope.	Tangannya terluka karena digeret dengan tali tajam.
Kapotin	https://dictionary.basabali.org/Kapotin	https://www.youtube.com/embed/fun1S0DWnsY?	Bunga mawané kapotin tekén Putu.	The rose was planted in a pot by Putu.	Bunga mawar itu ditanam pada pot oleh Putu.
Kapotong	https://dictionary.basabali.org/Kapotong	https://www.youtube.com/embed/avDrTdfFZq0?	Ulamé punika kapotong olih ida. Wusan mapotong, ulamé kagenahang ring kulkasé.	The meat was cut by him. After cutted, the meat is placed in the refrigerator.	Daging itu dipotong oleh beliau. Setelah terpotong, daging itu diletakkan di dalam kulkas.
Kaprabain	https://dictionary.basabali.org/Kaprabain	https://www.youtube.com/embed/jsFYBn_fuuI?	Ida mayoga ring gunung, kaprabain antuk sang surya nyantos sang candra rikala wengi.	He meditated on the mountain, illuminated by the sun until the moonlight at night.	Beliau bertapa di gunung, disinari oleh sang surya hingga cahaya sang bulan di malam hari.
Kapracala	https://dictionary.basabali.org/Kapracala	https://www.youtube.com/embed/QfsoS6D3aoU?	Taruné punika kapracala olih alit-alité.	The tree was shaken by the children.	Pohon itu digoyang oleh anak-anak.
Kapracampah	https://dictionary.basabali.org/Kapracampah	https://www.youtube.com/embed/heEVs5qfYQg?	Kawéntenan peraturan daérah sané anyar puniki matetujon mangda basa Baliné nénten kapracampah.	The existence of this new regional regulation aims to prevent Balinese language from being underestimated.	Keberadaan peraturan daerah yang baru ini bertujuan agar bahasa Bali tidak diremehkan/dipandang rendah.
Kapracayain	https://dictionary.basabali.org/Kapracayain	https://www.youtube.com/embed/-D3xRy_tqAc?	Titiang kapracayain dados pangenter acara ring acara wanti warsa kota Denpasar.	I am trusted to be the host of the anniversary event of Denpasar city.	Saya dipercayai menjadi pembawa acara di acara ulang tahun kota Denpasar.
Kapraceda	https://dictionary.basabali.org/Kapraceda	https://www.youtube.com/embed/467OXPdm-TY?	Baos ipuné kapraceda olih anaké nika daweg parumané.	His words were reviled by that person during the meeting.	Perkataannya dicerca oleh orang itu pada saat rapat.
Kapraciriang	https://dictionary.basabali.org/Kapraciriang	https://www.youtube.com/embed/QPcvHf5G-Pk?	Wenginé mangkin pacang sabeh. Punika kapraciriang antuk nénten wénten bintang sané mapraba ring langité.	It will rain tonight. It was marked by no star shining at the sky.	Malam ini akan hujan. Itu ditandai dengan tidak ada bintang yang bersinar di langit.
Kapradain	https://dictionary.basabali.org/Kapradain	https://www.youtube.com/embed/BtVKlwXc5b4?	Ukirané punika ngancan ngamecikang sesampuné kapradain.	The carving is getting better after being painted in gold.	Ukiran itu semakin bagus setelah dicat emas.
Kapradatayang	https://dictionary.basabali.org/Kapradatayang	https://www.youtube.com/embed/OZO6Rw85plM?	Kawéntenan wangunan-wangunan ring pura Besakih punika kapradatayang olih kramané majeng ring torisé.	The existence of buildings in the temple of Besakih was explained by residents to tourists.	Keberadaan bangunan-bangunan di pura Besakih itu dijelaskan oleh para warga kepada para turis.
Kapragatang	https://dictionary.basabali.org/Kapragatang	https://www.youtube.com/embed/zAPvQe-AaeE?	Gaéné kapragatang tekén Wayan padidian.	The work was completed by Wayan alone.	Pekerjaan itu diselesaikan oleh Wayan sendirian.
Kapraiang	https://dictionary.basabali.org/Kapraiang	https://www.youtube.com/embed/Ja_lPhO8R0I?	Buruh cariké kapraiang ulian ujané tusing endang-endang.	The workers in the fields were dismissed because the rain did not subside.	Pekerja di sawah itu diliburkannya karena hujannya tidak reda-reda.
Kaprambat	https://dictionary.basabali.org/Kaprambat	https://www.youtube.com/embed/ZN0KdZtQomk?	Sampiané suba kaprambat tekén Iluh. Jani punduhang lan wadahin aji plastik apang tusing daki.	Sampian (a sequence of young coconut leaves for offering ceremony) has been given a decoration by Iluh. Now collect and pack it with plastic so it doesn't get dirty.	Sampian (rangkaian janur) itu sudah diberi hiasan oleh Iluh. Sekarang kumpulkan dan kemas dengan plastik agar tidak kotor.
Kapranata	https://dictionary.basabali.org/Kapranata	https://www.youtube.com/embed/xpM82BllhAc?	Raksasané makasami kapranata olih Sang Anoman.	All giants were conquered by Hanoman.	Semua raksasa ditaklukan oleh Sang Hanoman.
Kapula	https://dictionary.basabali.org/Kapula	https://www.youtube.com/embed/FPmZ-p3VN9M?	Makejang égar. Makejang pada jaen nginyukang nasi bekelné. Sambilanga madaar, Luh Ayu Manik ngajakin timpal-timpalné apang sawai menék gunung. Tatujoné nyiamin tetanduranné ané wawu kapula apang mentik. Apang tusing cara pejabaté, tuah bisa nanem punyan kayu nanging tuara ikun nyiamin disubané suud matanduran. Eda nempa pejabat ané nanem entik-entikan anggon pencitraan apang ngenah tresna lan sutindih tekéning pertiwi. Nanging apang saja sutindih lan bakti, pamulan ané katanem mentik mokoh. Makejang cumpu tur masemaya lakar buin menék gunung nyiamin entik-entikanné.	All were happy and enjoyed their rice meals. Luh Ayu Manik suggested to her friends that they should hike up the mountains more often. The aim being to water the newly planted trees to keep them alive. In this way they would not only get to plant them like the officials but also keep them alive by regular watering. Don't follow the officials' example of planting to create an image of being a caring and committed environmentalist. As far as possible be dedicated so that the planted trees grow and thrive. All agreed to regularly return to the mountain to water their trees.	Semuanya senang. Mereka terlihat menikmati nasi bekalnya. Sambil makan, Luh Ayu Manik mengajak teman-temannya untuk lebih sering mendaki gunung. Tujuannya adalah untuk menyiram pepohonan yang baru ditanam agar bisa hidup. Dengan cara itu, mereka tidak seperti kebiasaan para pejabat yang hanya bisa menanam, tetapi tidak rajin menyiramnya setelah selesai menanam. Jangan meniru pejabat yang menanam pohon hanya untuk pencitraan agar terlihat sayang dan berkomitmen menjaga pertiwi. Sebisanya, usahakan untuk benar-benar berdedikasi dan berbakti sehingga pohon yang ditanam tumbuh dan subur. Semua setuju sekaligus berjanji akan kembali mendaki gunung untuk menyiram tanaman mereka.
Karahajengan	https://dictionary.basabali.org/Karahajengan	https://www.youtube.com/embed/1QDr3mhmUPQ?	Dumogi sareng sami ngamangguhin kaselametan, karahajengan lan karahayuan. Om Santi Santi Santi Om.	Wishing everyone health, prosperity, and peace. Om Shanti Shanti Shanti Om	Mendoakan semua semoga dalam keadaan sehat, sejahtera, dan diberikan kedamaian. Om Shanti Shanti Shanti Om
Karahayuan	https://dictionary.basabali.org/Karahayuan	https://www.youtube.com/embed/1QDr3mhmUPQ?	Dumogi sareng sami ngamangguhin kaselametan, karahajengan lan karahayuan. Om Santi Santi Santi Om.	Wishing everyone health, prosperity, and peace. Om Shanti Shanti Shanti Om	Mendoakan semua semoga dalam keadaan sehat, sejahtera, dan diberikan kedamaian. Om Shanti Shanti Shanti Om
Karejek	https://dictionary.basabali.org/Karejek	https://www.youtube.com/embed/GI6S1ekzpJQ?	Malingé padem karejek olih krama desané.	The thief was attacked by villagers until death.	Maling itu mati diserang oleh warga desa.
Kareka	https://dictionary.basabali.org/Kareka	https://www.youtube.com/embed/eL2zwgDNmHY?	Kalender Baliné karéka olih Ketut Bambang Gde Rawi.	That Balinese calendar was written by Ketut Bambang Gde Rai.	Kalender bali itu ditulis oleh Ketut Bambang Gde Rai.
Karekaang	https://dictionary.basabali.org/Karekaang	https://www.youtube.com/embed/s2iJcA_AwT4?	Arca ring Pura Dalem karékaang pinaka Batara Siwa.	The statue in Pura Dalem is described as Lord Shiva.	Arca di Pura Dalem digambarkan sebagai Dewa Siwa.
Kareketang	https://dictionary.basabali.org/Kareketang	https://www.youtube.com/embed/BV8EZl6uc4U?	Kertas-kertasé ento kareketang aji lim kanji.	The paper is attached using glue made from tapioca flour.	Kertas-kertas itu dilekatkan menggunakan lem berbahan tepung tapioka.
Kareketin	https://dictionary.basabali.org/Kareketin	https://www.youtube.com/embed/nwlEtwoBhsM?	Tatune kareketin aji don binahong apang enggal uas.	The wound is attached to binahong leaves to get well soon.	Lukanya dilekati daun binahong agar cepat sembuh.
Karembag	https://dictionary.basabali.org/Karembag	https://www.youtube.com/embed/e-QDgXr_VHA?	Pikobetne setata karembag. Kanti kiap tiang ningehang.	The problem is always discussed verbally. I heard it until sleepy.	Permasalahannya selalu dibicarakan dengan bertele-tele. Sampai mengantuk saya mendengarnya.
Karembugang	https://dictionary.basabali.org/Karembugang	https://www.youtube.com/embed/QB8A9LM_AAk?	Upacara sané kalaksanayang malih kalih sasih, karembugang ring pura.	The ceremony, which was held in two months, was discussed at the temple.	Upacara yang dilaksanakan dua bulan lagi, dirembukkan di pura.
Karengaang	https://dictionary.basabali.org/Karengaang	https://www.youtube.com/embed/72TwvDmN_UI?	Tutur reramané tusing karengaang. Disubané nemu sengkala, mara ia maselselan.	His parents' advice was not heard by him. After finding a disaster, he regretted it.	Nasehat orang tuanya tidak dihiraukan. Setelah menemukan petaka, baru dia menyesal.
Karengin	https://dictionary.basabali.org/Karengin	https://www.youtube.com/embed/SlWLkqo9qjM?	Satondén masang genténg, raabé karéngin malu.	Before installing tiles, the roof is first fitted with ‘reng’.	Sebelum memasang genting, atap itu terlebih dahulu dipasangi reng.
Karentehang	https://dictionary.basabali.org/Karentehang	https://www.youtube.com/embed/C5YeCL5tqgc?	Wangunan punika karentehang olih ida santukan pacang kawangun balé sané anyar.	The building was demolished by him because a new building would be built.	Bangunan itu diruntuhkan oleh beliau karena akan dibangun bangunan yang baru.
Karentenang	https://dictionary.basabali.org/Karentenang	https://www.youtube.com/embed/qP_cdLsTq8c?	Utangné karéntenang tekén bank.	His debt is levied by the bank.	Hutangnya dibungakan oleh bank.
Karepah	https://dictionary.basabali.org/Karepah	https://www.youtube.com/embed/MP5vRMKo_X4?	Ulam bawiné karepah olih ipun. Wusan punika kaaturang ring makasami krama sané rauh irika.	The pork was divided by him. After that it was given to all residents who came there.	Daging babi itu dibagi-bagi olehnya. Setelah itu diberikan kepada semua warga yang datang di sana.
Karepotan	https://dictionary.basabali.org/Karepotan	https://www.youtube.com/embed/Zl5hUuyo4XE?	Ia nongos jumah sawiréh tusing buin ada karépotan. Gegaéné tuah pules dogén.	He stayed at home because there was no activity anymore. The job is just to sleep.	Ia diam di rumah karena tidak ada kesibukan lagi. Kerjaannya hanya tidur saja.
Karepotang	https://dictionary.basabali.org/Karepotang	https://www.youtube.com/embed/bMQJ3n_mPKA?	Makejang timpal-timpalné karepotang tekén Madé. Nanging Madé tusing taén engsap tekén pitulung timpal-timpalné. Yéning mani puan timpalné ngidih tulung, ia nyadia nulungin.	All of his friends are troubled by Made. But Made never forgets the help of his friends. If tomorrow the friend asks for help, he is willing to help.	Semua teman-temannya direpotkan oleh Made. Tetapi Made tidak pernah lupa dengan pertolongan teman-temannya. Jika besok lusa temannya meminta bantuan, dia bersedia membantu.
Karereh	https://dictionary.basabali.org/Karereh	https://www.youtube.com/embed/VTL-Nk4Aklc?	Sampun petang rahina okan idané nénten budal. Okané sampun karereh nyantos ka Jawi, sakewanten durung kapanggih.	It has been four days since he left home. His son has been searched to Java, but has not been found.	Sudah empat hari anak beliau tidak pulang. Anaknya sudah dicari hingga ke Jawa, tetapi belum ditemukan.
Karerehang	https://dictionary.basabali.org/Karerehang	https://www.youtube.com/embed/kGVeKDnYozg?	Jantos dumun ajebos ratu, kantun karerehang kwaca olih Wayan.	Wait a minute, sir, Wayan is still looking for clothes.	Tunggu dulu sebentar tuan, masih dicarikan baju oleh Wayan.
Karerehin	https://dictionary.basabali.org/Karerehin	https://www.youtube.com/embed/s60pcMhVgwg?	Saking dija ratu wawu ? Ratu karerehin olih rabiné.	Where had you been Sir ? You are sought after by your wife.	Dari mana Tuanku tadi ? Tuan dicari-cari oleh istri tuan.
Karerenang	https://dictionary.basabali.org/Karerenang	https://www.youtube.com/embed/MAN59eK4Xfc?	Montoré karérénang tekén polisiné ulian bas liu ngaba muatan.	The motorbike was stopped by the police for carrying too much cargo.	Motor itu dihentikan oleh polisi karena terlalu banyak membawa muatan.
Karesep	https://dictionary.basabali.org/Karesep	https://www.youtube.com/embed/RhYtHFkxrGM?	Acepok baang tutur, suba karesep baana.	Once given advice, he understood.	Sekali diberi nasihat, dia sudah mengerti.
Karesepang	https://dictionary.basabali.org/Karesepang	https://www.youtube.com/embed/pNl9usEbYus?	Munyin bapanne tusing karesepang teken Made. Ento mawinan ia salah tampi.	His father's words were not understood by Made. That caused him to misunderstand.	Perkataan ayahnya tidak dipahami oleh Made. Itu menyebabkan dia salah paham.
Karesikin	https://dictionary.basabali.org/Karesikin	https://www.youtube.com/embed/UABpLFty4SE?	Bale banjare sampun karesikin olih kramane makasami.	The Balai banjar (multipurpose hall) has been cleared by all residents.	Balai banjar (balai serbaguna) itu sudah dibersihkan oleh semua warga.
Kari	https://dictionary.basabali.org/Kari	https://www.youtube.com/embed/9OvhCvE-ojI?	Tiang ngelah panak telu. Ne pertama megae ring kapal. E…sane kedua kari masuk ring Satu Atap Pengiangan. Sane ketiga kari TK.	I have three children. The oldest work on a ship. Eehhh… The second one went to Satu Atap Pengiangan. The third one is still in kindergarten.	Saya punya anak tiga. Yang pertama bekerja di kapal. E…yang kedua masih bersekolah di Satu Atap Pengiangan. Yang ketiga masih TK.
Kari	https://dictionary.basabali.org/Kari	https://www.youtube.com/embed/P_iFyo-u1XI?	Memen tiange mangkin..kari madagang di Tukad Campuhan, wastane.	My mother now...is still selling at Campuhan River.	Ibu saya sekarang..masih berjualan di Sungai Campuhan, namanya.
Karicuan	https://dictionary.basabali.org/Karicuan	https://www.youtube.com/embed/bilQhXB1URA?	Ditu kone ada karicuan ulian liu anake tusing maan duman baas gratis uli pamrentah.	People said there was chaos because many people did not get a free portion of rice from the government.	Di sana katanya ada kericuhan karena banyak orang yang tidak mendapat bagian beras gratis dari pemerintah.
Kariinang	https://dictionary.basabali.org/Kariinang	https://www.youtube.com/embed/orPqnO39Qws?	Rahinane mangkin jagi wenten paruman indik karya sane pacang kalaksanayang ring pura. Bebaosan indik banten kariinang sadurung maosang indik dudonan upacara.	"Today there will be a meeting regarding the ceremony to be held in the temple. Talks about ""banten"" or offerings take precedence before talking about the arrangement."	Hari ini akan ada rapat mengenai upacara yang akan dilaksanakan di pura. Pembicaraan mengenai ‘banten’ atau persembahan didahulukan sebelum membicarakan mengenai susunan acara.
Karimpung	https://dictionary.basabali.org/Karimpung	https://www.youtube.com/embed/7BNNRAGGr1A?	Mesehe sami sampun karimpung olih prajurit Idane ring payudan.	All enemies have been destroyed by his soldiers on the battlefield.	Semua musuh sudah dibinasakan oleh prajurit beliau di medan perang.
Karinggit	https://dictionary.basabali.org/Karinggit	https://www.youtube.com/embed/waUjY24bbag?	Busunge karinggit teken meme apang ngenah renteb.	The coconut leaf is made into decoration shaped like jag by the mother to make it look festive.	Janur itu dibuat hiasan seperti gerigi oleh ibu agar terlihat meriah.
Karingkes	https://dictionary.basabali.org/Karingkes	https://www.youtube.com/embed/6unSpftjUlM?	Tikehe ento karingkes tur jaanga di tengah balene.	The mat is rolled up and placed in the room.	Tikar itu digulung dan diletakkan di dalam ruangan.
Karingkus	https://dictionary.basabali.org/Karingkus	https://www.youtube.com/embed/XkRfUGmL5_E?	Malingé karingkus tekén polisiné dugas nagih malaib ka Jawa.	The thief was arrested by the police when he wanted to go to Java.	Maling itu diringkus oleh polisi saat ingin pergi ke Jawa.
Karirigang	https://dictionary.basabali.org/Karirigang	https://www.youtube.com/embed/kpekBq4uv4Q?	Montor tamiuné karirigang di mukak umah tekén Pan Wayan.	The guest motorbike was lined up in front of the house by Mr. Wayan.	Motor tamunya dileretkan di depan rumah oleh Pak Wayan.
Karirihan	https://dictionary.basabali.org/Karirihan	https://www.youtube.com/embed/bAmvVEFgPhQ?	Tuah amonto karirihan cainé ? Anak cerik mara lekad dogén mirib bisa !	Just that much of your intelligence? Just a newborn child might be able to do it!	Hanya segitu saja kepandaianmu ? Anak kecil baru lahir saja mungkin bisa !
Karisakin	https://dictionary.basabali.org/Karisakin	https://www.youtube.com/embed/jQvccDDbnkc?	Pabianan tiangé karisakin tekén Pan Wayan miwah kurenanné sabilang wai.	My plantation is cleaned by Mr. Wayan and his wife every day.	Perkebunan saya dibersihkan oleh Pak Wayan dan istrinya setiap hari.
Karisebin	https://dictionary.basabali.org/Karisebin	https://www.youtube.com/embed/dAiiIK33Tos?	Tiang stata nunas ica ring Ida Sang Hyang Widhi, apang icéna rahayu tur tusing karisebin tekén anak ané ngelah keneh jélé.	I always appeal to Ida Sang Hyang Widhi, to be given safety and not be bothered by people who have bad intentions.	Saya selalu memohon kepada Ida Sang Hyang Widhi, agar diberi keselamatan dan tidak diganggu oleh orang yang mempunyai niat jahat.
Karma	https://dictionary.basabali.org/Karma	https://www.youtube.com/embed/nFkgP0uaEr0?	Karma sané becik pacang ngametuang pala sané becik.	Good deeds will produce good result.	Perbuatan yang baik akan menghasilkan perbuatan yang baik.
Karo	https://dictionary.basabali.org/Karo	https://www.youtube.com/embed/GGU0nKfnbWc?	Upacara puniki pacang kalaksanayang ring sasih karo.	This ceremony will be held on the second month of the Bali calendar (August).	Upacara ini akan dilaksanakan pada bulan kedua pada kalender Bali (Agustus).
Karoangin	https://dictionary.basabali.org/Karoangin	https://www.youtube.com/embed/DFbb_E1KNgQ?	Tiang ngaé tugas sekolah karoangin tekén Nyoman lan Ketut.	I made a school assignment assisted by Nyoman and Ketut.	Saya membuat tugas sekolah dibantu oleh Nyoman dan Ketut.
Karobedang	https://dictionary.basabali.org/Karobedang	https://www.youtube.com/embed/tkHT7JPz8n8?	Idupné karobedang tekén anak ane tusing demen tekén ia.	His life was troubled by people who didn't like him.	Hidupnya disusahkan oleh orang yang tidak suka dengannya.
Karobelah	https://dictionary.basabali.org/Karobelah	https://www.youtube.com/embed/FZShbZRsFaI?	Guna: Yen bangunan, bangunan napi manten ne taen jemak, Pak? Ne misi ukiran bias. Nengah: kenten..sakadi niki, karyan goak puniki wantah mangge ring..kentene..ring palinggih niki. Palinggih, candi, napi ye wentene. Umah, kenten. Guna: Mm. Bale, Pak, punapi? Nengah: Taler ja.. masih. Guna: Mm..nggih. Ampun kenten, akuda, Pak, maan per hari yen nyemak gae kene? Nengah: Menurut isine niki. Yen sakadi niki…e…don-don niki tiga, kalih…polih, kenten. Kadang-kadang pat polih yen luung bayu, kenten. Guna: Ji kuda kira-kira nika awaine maan, Pak? Nengah: Polih nyeng…ji karobelah, kenten.	-	Guna: Kalau bangunan, bangunan apa saja yang pernah napi diambil, Pak? Yang berisi ukiran pasir. Nengah: Anu..seperti ini, karya gagak ini hanya dipakai di..anu..di palinggih (tempat meletakkan sajen sembahyang dan berdoa) ini. Palinggih, candi, apa saja yang ada. Rumah, begitu. Guna: Mm. Bale, Pak, gimana? Nengah: Iya juga. Guna: Mm..ya. Sudah begitu, berapa, Pak, dapat per hari kalau mengambil pekerjaan begini? Nengah: Tergantung isinya ini. Kalau seperti ini…e…daun-daun ini tiga, dua…dapat, begitu. Kadang-kadang empat dapat kalau energi lagi bagus, begitu. Guna: Berapa kira-kira seharinya itu dapat, Pak? Nengah: Dapat sekitar…seratus lima puluh, begitu.
Karodain	https://dictionary.basabali.org/Karodain	https://www.youtube.com/embed/dAu9PHqVFQM?	Mejané karodain apang aluh yen lakar ngisidang.	The table is fitted with wheels to make it easy if you want to move it.	Meja itu dipasangi roda agar mudah jika ingin memindahkannya.
Karoges	https://dictionary.basabali.org/Karoges	https://www.youtube.com/embed/4I6BKfkTkXs?	Liman tiangé karoges baan kukunné ane mangan.	My hands were clawed with sharp nails.	Tangan saya dicakar dengan kukunya yang tajam.
Karombo	https://dictionary.basabali.org/Karombo	https://www.youtube.com/embed/TTTDjpJvZbw?	Tiang menahin pagehan karombo tekén pisagan tiangé.	I repaired the fence helped by my neighbor.	Saya memperbaiki pagar dibantu oleh tetangga saya.
Karongrong	https://dictionary.basabali.org/Karongrong	https://www.youtube.com/embed/iwaxMWsatrY?	Padiné telah usak uliang karongrong blabar dugas ujan bales dibi sanja.	All rice was damaged because it was flooded during heavy rains yesterday afternoon.	Semua padi rusak karena dirongrong banjir ketika hujan lebat kemarin sore.
Karosrosang	https://dictionary.basabali.org/Karosrosang	https://www.youtube.com/embed/z1TzC7D6xnU?	Bungan jepunné karosrosang tekén mémé di duur mejané.	The frangipani flower was scattered by the mother on the table.	Bunga kamboja itu dicecerkan oleh ibu di atas meja.
Karot	https://dictionary.basabali.org/Karot	https://www.youtube.com/embed/yNNUu62384Q?	Katik saténé karot tekén Bapa kanti alus.	The skewer was mashed up by the father until smooth.	Tusukan sate itu diraut oleh ayah hingga halus.
Karubuhang	https://dictionary.basabali.org/Karubuhang	https://www.youtube.com/embed/tzIa9WC1oa8?	Baléné ento karubuhang sawiréh bapa lakar nyumunin ngaé balé ané anyar.	The building was torn down because dad would rebuild the building by a new one.	Bangunan itu dirobohkan karena ayah akan mengulang membuat bangunan yang baru.
