page_title	page_url	video_url	balinese	english	indonesian
Karubuhin	https://dictionary.basabali.org/Karubuhin	https://www.youtube.com/embed/Bdq8VNwBBRg?	Mobil tiangé karubuhin baan punyan kayu gédé di jalané.	My car was hit by a large wooden tree on the road.	Mobil saya tertimpa pohon kayu besar di jalan.
Karudeg	https://dictionary.basabali.org/Karudeg	https://www.youtube.com/embed/jZAhJZVxfw8?	Pan Wayan pedih ulian karudeg tekén panakné dugas megaé.	Pak Wayan was angry because he was disturbed by his son while working.	Pak Wayan marah karena diganggu oleh anaknya ketika bekerja.
Karuetang	https://dictionary.basabali.org/Karuetang	https://www.youtube.com/embed/xnlKnW9GfAQ?	Gaé ané aluh ento karuetang tekén Wayan. Ia tusing nyak ngidih tulung tekén timpal-timpalné.	The easy work was made difficult by Wayan. He doesn't want to ask his friends for help.	Pekerjaan yang mudah itu dibuat sulit oleh Wayan. Dia tidak mau meminta tolong kepada teman-temannya.
Karugeh	https://dictionary.basabali.org/Karugeh	https://www.youtube.com/embed/VB_NKAdr_Mw?	Jajan tiangé karugeh tekén Ketut. Tiang tuah maan jaja asibak.	My cake was forcibly requested by Ketut. I only got half a cake.	Kue saya diminta dengan paksa oleh Ketut. Saya hanya mendapat kue separuh.
Karugiang	https://dictionary.basabali.org/Karugiang	https://www.youtube.com/embed/ot0SZxnzI60?	Yen liu anaké korupsi, sinah rakyaté ané karugiang.	If many people are corrupt, then the people will be harmed.	Jika banyak orang yang korupsi, maka rakyatlah yang akan dirugikan.
Karugrag	https://dictionary.basabali.org/Karugrag	https://www.youtube.com/embed/FSQMrC7Bd8w?	Isin umahné karugrag dugas ngalihin bukuné ané ilang.	The contents of his house were dismantled when searching for his missing book.	Isi rumahnya dibongkar ketika mencari bukunya yang hilang.
Karugragang	https://dictionary.basabali.org/Karugragang	https://www.youtube.com/embed/SUS1VgEANNo?	Pintuné ento karugragang aji linggis.	The door was dismantled using a crowbar.	Pintu itu dibongkar menggunakan linggis.
Karujakang	https://dictionary.basabali.org/Karujakang	https://www.youtube.com/embed/TO68pjVL3SU?	Pohé ané alapa tekén Madé ento karujakang tekén timpal-timpalné.	The mango picked by Made was made ‘rujak’ (kind of fruit salad) by his friends.	Mangga yang dipetik oleh Made itu dijadikan rujak oleh teman-temannya.
Karujit	https://dictionary.basabali.org/Karujit	https://www.youtube.com/embed/1gJ2DjBlF6I?	Bokné Ketut karujit tekén bapanné.	Ketut's hair was cut short by his father.	Rambutnya Ketut dipotong pendek oleh ayahnya.
Karumbingin	https://dictionary.basabali.org/Karumbingin	https://www.youtube.com/embed/0YEOeIvJqFI?	Kupingné karumbingin aji rumbing mawarna mas satondén mapoto.	His ears are fitted with a gold-colored 'rumbing' (ear stud that looks like a small snail) before taking a photo.	Telinganya dipasangi dengan ‘rumbing’ (giwang yang bentuknya seperti siput kecil) berwarna emas sebelum berfoto.
Karumitang	https://dictionary.basabali.org/Karumitang	https://www.youtube.com/embed/U-_IW8bAHH0?	Petakonné karumitang apang kéweh anaké nyaurin.	The question is made difficult so that people can't answer it.	Pertanyaannya dibuat susah agar susah orang menjawabnya.
Karumpiukang	https://dictionary.basabali.org/Karumpiukang	https://www.youtube.com/embed/lT2zdfM6JvA?	Murid-muridé karumpiukang di lapangané sawiréh ada pawarah uli bapak kepala sekolah.	The students were gathered in the field because there was an appeal from the principal.	Murid-murid itu dikumpulkan di lapangan karena ada himbauan dari bapak kepala sekolah.
Karumrum	https://dictionary.basabali.org/Karumrum	https://www.youtube.com/embed/c1rVNcpPq4U?	Tiang karumrum tekén timpal tiangé apang milu pacentokan mapidarta.	I was persuaded by my friend to take part in the speech contest.	Saya dibujuk oleh teman saya supaya ikut lomba berpidato.
Karundingang	https://dictionary.basabali.org/Karundingang	https://www.youtube.com/embed/h2kmh-dR44A?	Dudonan acara ring pura punika karundingang olih krama desané ring wantilan.	The program in the temple was negotiated by the villagers at the multi-purpose hall.	Susunan acara di pura itu dirundingkan oleh warga desa di balai serba guna.
Karungah-rungah	https://dictionary.basabali.org/Karungah-rungah	https://www.youtube.com/embed/ovGhyHkevGM?	Putu engsap ngaba dompét ulian karungah-rungah luas ka umah timpalné.	Putu forgot to bring his wallet because he was in a hurry to go to his friend's house.	Putu lupa membawa dompet karena tergesa-gesa pergi ke rumah temannya.
Karungu	https://dictionary.basabali.org/Karungu	https://www.youtube.com/embed/oDaTzsLCeSI?	Kawéntenan wantuan buku gratis saking pamréntah punika nénten karungu olih kramané, pamekasnyané alit-alité.	The existence of free books from the government is ignored by residents, especially children.	Keberadaan bantuan buku gratis dari pemerintah itu tidak dihiraukan oleh warga khususnya anak-anak.
Karunguang	https://dictionary.basabali.org/Karunguang	https://www.youtube.com/embed/Jw346YwqpWE?	Sekat kalaina tekén Bapanné, I Ketut karunguang tekén dadongné.	Since left by his father, Si Ketut was cared for by his grandmother.	Sejak ditinggal oleh ayahnya, Si Ketut dirawat oleh neneknya.
Karupaka	https://dictionary.basabali.org/Karupaka	https://www.youtube.com/embed/_B2xTYK4LiE?	Lampu listrik sané kapertama karupaka olih Thomas Alva Edison duk warsa 1879.	The first electric light was created by Thomas Alva Edison in 1879.	Lampu listrik yang pertama diciptakan oleh Thomas Alva Edison pada tahun 1879.
Karurah	https://dictionary.basabali.org/Karurah	https://www.youtube.com/embed/DKagPNvAwX0?	Pamulan kacang tiangé karurah baan beburonné.	My pea plants were damaged by animals.	Tanaman kacang saya dirusak oleh binatang.
Karurahin	https://dictionary.basabali.org/Karurahin	https://www.youtube.com/embed/ztU_pIvAkFg?	Dompét tiangé karurahin tekén anaké ento. Jani ia suba juka tekén polisiné.	My wallet was seized by that person. Now he has been arrested by the police.	Dompet saya dirampas oleh orang itu. Sekarang ia sudah ditangkap oleh polisi.
Karuron	https://dictionary.basabali.org/Karuron	https://www.youtube.com/embed/EbCv0tQECMM?	Kurenan tiangé karuron. Uli dibi peteng tiang nongosin kurenan di rumah sakit.	My wife miscarried. Since last night I waited for my wife at the hospital.	Istri saya keguguran. Sejak kemarin malam saya menunggu istri saya di rumah sakit.
Karurusang	https://dictionary.basabali.org/Karurusang	https://www.youtube.com/embed/rNuKjQa7Fa0?	Besiné ento karurusang tekén bapa aji linggis.	The iron is straightened by the father using a crowbar.	Besi itu diluruskan oleh ayah menggunakan linggis.
Karusakang	https://dictionary.basabali.org/Karusakang	https://www.youtube.com/embed/ay2FoZNJYyg?	Abian titiangé karusakang olih buron sané rusuh.	My garden was damaged by riotous animals.	Kebun saya dirusak oleh binatang yang rusuh.
Karwan	https://dictionary.basabali.org/Karwan	https://www.youtube.com/embed/8OVZtEeosUI?	I Luh: Dadi bisa keto, Beli? Adi: Musime jani sing karuan-karuan.	I Luh: Why is that, Brother? Adi: Today’s weather is uncertain.	I Luh: Kok bisa begitu, Kak? Adi: Musim sekarang ini tidak menentu.
Karya	https://dictionary.basabali.org/Karya	https://www.youtube.com/embed/tF7cTh0u87A?	Punapi Ayu, asil karya para pelukis sane kapajang ring Museum Neka niki?	Ayu, what do you think about the artworks that is displayed in the Neka Museum?	Bagaimana Ayu, hasil karya para pelukis yang dipajang di Museum Neka ini?
Kasaatang	https://dictionary.basabali.org/Kasaatang	https://www.youtube.com/embed/JVePoFDWizk?	Eda bas ruet, unduké ené lakar kasaatang tekén bapan tiangé.	Don't be too frantic, this will be done by my father.	Jangan terlalu kalut, urusan ini akan diusahakan oleh ayah saya.
Kasaban	https://dictionary.basabali.org/Kasaban	https://www.youtube.com/embed/B9qPyqLfdi4?	Dugas ujan dibi sanja, panak tiangé kasaban ningehang munyin tatit.	When it was raining yesterday afternoon, my child was shocked and screamed at the sound of lightning.	Ketika hujan kemarin sore, anak saya terkejut dan menjerit mendengar suara petir.
Kaselametan	https://dictionary.basabali.org/Kaselametan	https://www.youtube.com/embed/1QDr3mhmUPQ?	Dumogi sareng sami ngamangguhin kaselametan, karahajengan lan karahayuan. Om Santi Santi Santi Om.	Wishing everyone health, prosperity, and peace. Om Shanti Shanti Shanti Om	Mendoakan semua semoga dalam keadaan sehat, sejahtera, dan diberikan kedamaian. Om Shanti Shanti Shanti Om
Kasengguh	https://dictionary.basabali.org/Kasengguh	https://www.youtube.com/embed/lnJcsmZ4Esc?	Buka nlimpuk takilan puyung, I Wayan Dunia kasengguh ngamaling pratima purane, yadiastun ia tusing nawang unduk apa-apa.	Like being tripped over an empty container, I Wayan Dunia was accused of stealing his Temple’s holy relic, even though he has nothing to do with the theft (said of a person who is blmaed for something bad or some wrong act, but who is innocent and did nothing wrong).	Seperti tersandung bungkusan kosong, I Wayan Dunia disangka mencuri Pratima Puranya, walaupun ia tidak tahu apa-apa tentang hal itu.
Kaserung	https://dictionary.basabali.org/Kaserung	https://www.youtube.com/embed/qhTZbMhyz6A?	Ulian saktine, Luh Ayu Manik Mas nyidaang ngejuk malinge ento. Glalang-gliling malinge di margane. Jejeh ia sada ngidih pelih. Liu sajan kramane ane mabalih lan nyuryakin malinge ento sambilanga ngrimik. “Ulian solah jele ane kene suba ngranayang adan Baline usak!” Malinge ngejer ngetor ulian kaserung baan kramane lantas ulianga tas bulene ane mara palinga. Di tengah tas bulene ada magenepan luire handphone, laptop, dompet, miwah dokumen-dokumen ane penting. Malinge ento lantas sregepe teken polisine.	Because of her supernatural powers, Luh Ayu Manik Mas was able to overcome the bag snatcher. The thief rolled about on the road and, out of fear, he begged for forgiveness. Many people were watching and they yelled abuse and grumbled. “Because of this kind of bad behaviour, the good name of Bali has been tarnished!” The thief trembled with fear because he was surrounded by a mob. Then he handed over the tourist's bag that he had just stolen. In the bag there were many things, like a cell phone, laptop, wallet and other important documents. The thief was arrested by the police.	Berkat kesaktiannya, Luh Ayu Manik Mas berhasil menangkap penjambret itu. Si penjambret berguling-guling di jalan. Ia takut sembari memohon maaf. Banyak sekali warga yang menonton dan menyorakinya sambil menggerutu. “Karena perilaku yang jahat seperti inilah nama baik Bali rusak!” Si penjambret gemetar ketakutan karena dikerumuni warga. Lalu tas bule yang baru dirampasnya itu dikembalikan. Di tengah tas bule itu ada banyak barang seperti gawai, laptop, dompet, dan dokumen-dokumen yang penting. Pencuri itu lalu ditangkap polisi.
Kasub	https://dictionary.basabali.org/Kasub	https://www.youtube.com/embed/lClnIMAKoP4?	Liang kenehne Pan Kocong maan undangan ka umah Pan Gede Dana, sawireh Pan Gede Dana mula kasub aji kasugihan. Sakewala, cara kedis perite malali ka punyan bingine; payu maan ngetis nanging basangne puyung. Kanti peteng ia tusing maan yeh ning.	Pan Kocong was really excited when he got an invitation to Pan Gede Dana's house because Pan Gede Dana is well known for his prosperity. Alas, just like a sparrow in a banyan tree; it can stay in a shady tree but it's tummy is empty. Until night he did not get even any water to drink.	Senang hatinya Pak Kocong mendapat undangan ke rumah Pak Gede Dana, karena Pak Gede Dana memang terkenal dengan kekayaannya. Akan tetapi, seperti burung pipit bermain ke pohon beringin; jadinya dapat berteduh tapi perutnya kosong. Sampai malam ia tidak mendapat air bening.
Kasugihan	https://dictionary.basabali.org/Kasugihan	https://www.youtube.com/embed/lClnIMAKoP4?	Liang kenehne Pan Kocong maan undangan ka umah Pan Gede Dana, sawireh Pan Gede Dana mula kasub aji kasugihan. Sakewala, cara kedis perite malali ka punyan bingine; payu maan ngetis nanging basangne puyung. Kanti peteng ia tusing maan yeh ning.	Pan Kocong was really excited when he got an invitation to Pan Gede Dana's house because Pan Gede Dana is well known for his prosperity. Alas, just like a sparrow in a banyan tree; it can stay in a shady tree but it's tummy is empty. Until night he did not get even any water to drink.	Senang hatinya Pak Kocong mendapat undangan ke rumah Pak Gede Dana, karena Pak Gede Dana memang terkenal dengan kekayaannya. Akan tetapi, seperti burung pipit bermain ke pohon beringin; jadinya dapat berteduh tapi perutnya kosong. Sampai malam ia tidak mendapat air bening.
Kasukan	https://dictionary.basabali.org/Kasukan	https://www.youtube.com/embed/-Zueobv6OaQ?	Ento mawanan Meme lan Bapan Luhe ngajak malukat, apang I Luh nemu kasukan lan padewekan nirmala.	Therefore your mother and father urge you to perform purification, so that you will achieve happiness and a peaceful soul.	Itulah alasan Ibu dan Bapak I Luh mengajak malukat, agar I Luh memperoleh kebahagiaan dan kesucian diri.
Kasumbung	https://dictionary.basabali.org/Kasumbung	https://www.youtube.com/embed/usxy_gJyun8?	Desa Kukuh Kecamatan Marga, Kabupaten Tabanan kasumbung ka mancanegari santukan kawentenan daya tarik wisata Alas Kedaton. Ring Desa Kukuh taler akeh wenten kerajinan ukir kayu. Kerajinan puniki nglimbak duk warsa 1992. Kerajinan puniki sampun dados industri. Akeh krama Kukuh, cerik kelih tua bajang, makarya ring ukiran kayu. Kerajinan puniki taler nglimbak ke pakubon warga. Sane ngukir nenten krama lanang kemanten. Krama istri akeh taler waged ngukir kayu. “Tiang ngukir uling SD. Tiang muruk jumah. Mbok tiang nguruka. Ngukir ringring maan upah 20 ribu. Sambilan ngempu nika.” Inggih, asapunika prasida atur uningayang titiang indik kawentenan seni ukir ring Desa Kukuh.	The village of Kukuh in the district of Marga is known throughout many countries because of the tourist attraction called Alas Kedaton. In Kukuh there is also a lot of woodcarving. Woodcarving started to become popular in 1992 and has since become an industry. Many in the village of Kukuh – children, adults, the elderly as well as adolescents – engage in woodcarving. And woodcarving has become a cottage industry i.e. carvings are done at home. It is not only men who do woodcarving. There are also many women who are good at carving wood. “I have been carving since Elementary School. I learned at home. My older sister taught me. Carving a ringring* gets me about twenty thousand Rupiah. I do it while looking after my children.” So that’s what I can tell you about the art of carving in Kukuh. Elaborately carved decorative edges for buildings, often painted.	Desa Kukuh Kecamatan Marga, Kabupaten Tabanan terkenal ke mancanegara karena keberadaan daya tarik wisata Alas Kedaton. Di Desa Kukuh juga banyak terdapat kerajinan ukir kayu. Kerajinan ini meluas pada tahun 1992. Kerajinan ini sudah menjadi industri. Banyak warga Kukuh, kecil dewasa tua remaja, membuat ukiran kayu. Kerajinan ini juga meluas ke rumah warga. Yang mengukir bukan hanya warga laki-laki. Warga perempuan banyak juga pandai mengukir kayu. “Saya mengukir sedari SD. Saya belajar di rumah. Kakak perempuan saya yang mengajari saya. Mengukir ringring (ukiran tirai) mendapat upah 20 ribu. Itu sambil mengasuh anak.” Baik, demikianlah saya informasikan tentang keberadaan seni ukir di Desa Kukuh.
Katabasin	https://dictionary.basabali.org/Katabasin	https://www.youtube.com/embed/eADtTEn4-no?	Wusan ngebah tiyingé punika, raris katabasin antuk parang olih I Gusti Rai.	After cutting down the bamboo, then flattened using machete by I Gusti Rai.	Setelah menebang bambu itu, lalu diratakan dengan parang olih I Gusti Rai.
Katabianin	https://dictionary.basabali.org/Katabianin	https://www.youtube.com/embed/xjp3yjER034?	Eda ngéndah cai ngalawan rerama, katabianin nyen matan cainé apang nawang kapok!	Don't you behave brashly against your father, I'll give you chili on your eyes to deter you!	Jangan kau berperilaku kurang ajar melawan ayahmu, kuberi cabai matamu biar jera!
Katabingin	https://dictionary.basabali.org/Katabingin	https://www.youtube.com/embed/PD4Kj6f55rc?	Wangunan ento katabingin satonden karaabin.	The Building was fitted with a wall before fitted with a roof.	Bangunan itu dipasangi dinding sebelum dipasangi atap.
Katadah	https://dictionary.basabali.org/Katadah	https://www.youtube.com/embed/ZMdFCov0nqU?	Ring carita punika, akéh wanarané sané katadah olih raksasa.	In that story, many monkeys are devoured by giants.	Di cerita itu, banyak kera yang dimangsa oleh raksasa.
Katadongang	https://dictionary.basabali.org/Katadongang	https://www.youtube.com/embed/Mni-r5BRyPU?	Kertasé suba katadongang tekén prawartaka, iraga tuah ngaba potlot lan penghapus.	Paper has been provided by the committee, we only carry pencils and erasers.	Kertas sudah disediakan oleh panitia, kita hanya membawa pensil dan penghapus.
Katadtad	https://dictionary.basabali.org/Katadtad	https://www.youtube.com/embed/HBsWHaGXNwU?	Tas tiangé katadtad tekén Madé sawireh liman tiangé sakit.	My bag was carried by Made because my hand hurt.	Tas saya ditenteng oleh Made karena tangan saya sakit.
Katadtadang	https://dictionary.basabali.org/Katadtadang	https://www.youtube.com/embed/GhE2ozcXf4g?	Praboté ento katadtadang nuju ka wantilan.	The furniture was carried to the village hall.	Perabotan itu ditentengkan menuju ke balai desa.
Katanem	https://dictionary.basabali.org/Katanem	https://www.youtube.com/embed/Hplw_fRAlkw?	Tusing ada punyan kayu tileh, sajaba enu bongkolné dogén. Mirib duratmaka ngamaling punyan-punyanan kayuné. Luh Ayu Manik sedih, yadiastun ada pos polisi hutan nanging duratmakané nyidaang ngamaling. Apa polisi hutané kalah macadeng ajak i duratmaka. Apa mapi-mapi buta bongol ada maling ngalgal alas. Dot ia nyambatang unduké ento tekén uané ané dadi polisi hutan. Timpalné masih tepukina sedih ningalin alasé usak. Luh Ayu Manik lantas ngajakin timpal-timpalné nandur taruné. Makejang sregep magaé. Disubané makejang katanem mara lantas marérén sambilanga ngagah bekelné soang-soang.	There wasn't a tree in tact, only the trunks remained. Perhaps criminals had stolen the timber. Luh Ayu Manik was sad because, despite having a forest ranger post, thieves were still able to operate. Were the rangers in fear of the thieves? Were the forest rangers pretending to be deaf and blind whilst the thieves were felling the trees of the jungle? She wished to raise this issue with her uncle who had become a forest ranger. Her friends were also sad at the sight of the devastated forest. Luh Ayu Manik, along with her friends, began to plant trees. They all worked hard. After all had been planted, only then did they take a rest and each partake of their refreshments.	Tidak ada pohon yang utuh, kecuali yang tersisa pangkalnya. Mungkin ada penjahat yang mencuri pohon-pohon ini. Luh Ayu Manik sedih karena meskipun ada pos Polisi Hutan, tetapi penjahat tetap bisa mencuri. Apakah polisi hutan itu kalah berani melawan si penjahat? Apakah mereka berpura-pura buta dan tuli jika ada pencuri yang merabas hutan? Ia ingin menyampaikan hal itu kepada pamannya yang menjadi Polisi Hutan. Sahabatnya juga terlihat sedih melihat kondisi hutan yang rusak. Luh Ayu Manik lalu mengajak teman-temannya menanam pohon. Semuanya sigap bekerja. Setelah semuanya ditanam barulah mereka beristirahat sambil membuka bekal masing-masing.
Katebag	https://dictionary.basabali.org/Katebag	https://www.youtube.com/embed/94ls0a2fNBk?	Suba katebag tekén murid-muridé yéning ibu guru tusing lakar teka dinané jani.	It was guessed by students that the teacher's mother would not come today.	Sudah ditebak oleh murid-murib bahwa ibu guru tidak akan datang hari ini.
Katebah	https://dictionary.basabali.org/Katebah	https://www.youtube.com/embed/oxFUJiN_W20?	Liman tiangé katebah tekén anak tawah dugas negakin motor di rurungé ané suung.	My hands have been stabbed by strangers when riding a motorcycle on a quiet road.	Tangan saya pernah ditikam oleh orang asing ketika mengendarai motor di jalan yang sepi.
Katebas	https://dictionary.basabali.org/Katebas	https://www.youtube.com/embed/0ONjUai1V-A?	Karangé punika sampun katebas olih Ida.	The land was redeemed by him.	Tanah itu sudah ditebus oleh beliau.
Katebeg	https://dictionary.basabali.org/Katebeg	https://www.youtube.com/embed/w-kLAe4lgAw?	Cariké suba katebeg tekén bapa yadiastun tondén masan ujan.	The rice fields have been hoeed by the father even though it hasn't been in the rainy season.	Sawah itu sudah dicangkul oleh ayah walaupun belum musim hujan.
Katebegang	https://dictionary.basabali.org/Katebegang	https://www.youtube.com/embed/PMJ4XiWnlsk?	Suba aminggu tegalé ento katebegang tekén I Putu.	It was a month that was hoeed by the Putu.	Sudah sebulan ladang itu dicangkul oleh si Putu.
Katebegin	https://dictionary.basabali.org/Katebegin	https://www.youtube.com/embed/lKu31aXGp6Y?	I Bapa pedih sawiréh pundukanné telah katebegin.	Father was angry because his rice fields had been hoeed.	Ayah marah karena pematang sawahnya habis dicangkuli.
Katimpalin	https://dictionary.basabali.org/Katimpalin	https://www.youtube.com/embed/yVdXceAdbWc?	Saget gumine suba peteng dedet. Luh Ayu Manik lan Putu Nita suba pada majanji lakar mabalih ogoh-ogoh ka marga gedene. Ngenggalang Luh Ayu Manik mapayas lan makamen lantas ngalih Putu Nita jumahne. Neked di margane, saget suba rame anake mabalih ogoh-ogoh. Ngon lan jejeh ajaka dadua nepukin ogoh-ogoh ane gobane aeng-aeng cara raksasa, macaling renggah, mabok gumbrang-gambring, lan makuku lantang-lantang. Saja mirib goba aeng ogoh-ogohe ento bisa ngaenang sarwa butane jejeh. Keto masih suryak-suryak truna-trunane marasa liang ritatkala negen ogoh-ogohe, ane katimpalin baan munyin gamelan blaganjure.	The day became night. Luh Ayu Manik and Putu Nita made a promise that they would watch the ogoh-ogoh on the main road. Luh Ayu Manik quickly put on makeup and got dressed in a sarong and then went to Putu Nita’s house to meet her. When they got to the main road, there were already a lot of people there wanting to see the ogoh-ogoh. They were amazed but also frightened to see the ogoh-ogoh which looked sinister like giants with long, pointed tusks, messy hair and long nails. Maybe it's true that those scary faces of the ogoh-ogoh can make evil spirits afraid. And the cheers of the young people who were happy carrying the ogoh-ogoh were accompanied by the sounds of gamelan.	Tidak terasa dunia sudah gelap. Luh Ayu Manik dan Putu Nita sudah berjanji akan menonton ogoh-ogoh di jalan raya. Luh Ayu Manik dengan cepat berhias, menggunakan kain, lalu mencari Putu Nita ke rumahnya. Sesampai di jalan, ternyata jalanan sudah ramai oleh warga yang ingin menonton ogoh-ogoh. Heran sekaligus takut mereka berdua melihat ogoh-ogoh yang rupanya seram seperti raksasa, bertaring panjang dan runcing, berambut berantakan. dan berkuku panjang-panjang. Mungkin benar, wajah ogoh-ogoh yang seram itu bisa menyebabkan para makhluk halus yang jahat menjadi takut. Tambahan pula adanya sorak-sorai para pemuda yang merasa senang pada saat memikul ogoh-ogoh diiringi suara blaganjur.
Katumbas	https://dictionary.basabali.org/Katumbas	https://www.youtube.com/embed/iBzsJHAABG4?	Sari: Niki taler kaolah secara alami, nggih? Geg Diah: Pateh samalih uyahe puniki seos rasane ring uyah sane katumbas ring pasare.	Sari: This is organically produced, right? Geg Diah: The taste of this salt is different from the salt at the market.	Sari: Ini juga diolah secara alami, ya? Geg Diah: sama dengan garam ini lain rasanya dengan garam yang dibeli di pasar.
Katurang	https://dictionary.basabali.org/Katurang	https://www.youtube.com/embed/d3CLzTsHb2k?	Ayah-ayah sane katurang minakadi ngayah majejaitan, ngwastranin palinggih, miwah parikrama ayah-ayahan sane tiosan.	Among those volunteering works performed are majejaitan (making offerings from young coconut leaves), decorating the shrines, and any common volunteering works.	Kegiatan sukarela yang dipersembahkan, antara lain ngayah majejaitan (membuat alat-alat pelengkap sajen dari janur sebagai bahan utama), memasangkan kain pada palinggih (bangunan suci), serta tradisi kegiatan sukarela lainnya.
Katurin	https://dictionary.basabali.org/Katurin	https://www.youtube.com/embed/_2D1lMrsEEM?	Makasami sarana utama sane katurin ring para tetamune ring The Laguna Resort and Spa.	These are the main facilities that we offer to our guests at The Laguna Resort and Spa.	Semuanya adalah fasilitas utama yang dipersembahkan untuk para tamu di The Laguna Resort and Spa.
Kau	https://dictionary.basabali.org/Kau	https://www.youtube.com/embed/CuPsRgoiP7w?	Jani kar manggang sate be pasih. Ne…kau-kau. Adeng. Adeng kau-kau. Papah punyan nyuh, katikne. Be pasih misi nyuh, misi basa, mapilit. Komang nu milit. Benjep lakar panggang. Suud panggang, makan len. Jaen.	Now I’m going to grill some fish sate. This is … a piece of coconut husk. Charcoal. Charcoal made from the husk of a coconut. The midrib of the coconut leaf (is) the skewer for the sate. The fish is mixed with coconut and spices and then pressed around the skewer. Komang is doing that right now. Then we will grill them. And after we grill them we will eat them. Delicious.	Sekarang mau memangggang sate ikan. Ini…tempurung kelapa. Arang. Arang tempurung kelapa. Pelepah pohon kelapa, tangkainya. Ikan laut berisi kelapa, berisi bumbu, dililit. Komang masih melilitnya. Nanti akan dipanggang. Selesai memanggang, mari dimakan. Enak.
