page_title	page_url	video_url	balinese	english	indonesian
Kauh	https://dictionary.basabali.org/Kauh	https://www.youtube.com/embed/pxPJqXZ97L4?	Drika beneng kauh malih, Bapak, terus beneng kauh drika. Ampun..pun Peken…e.. Ubud drika.	From there keep going west, Sir, then keep going west there. There it is The Ubud… err..Market.	Di sana lurus ke barat lagi, Bapak, terus lurus ke barat di sana. Sudah Pasar…e.. Ubud di sana.
Kauh	https://dictionary.basabali.org/Kauh	https://www.youtube.com/embed/piYVvMMDcrE?	Pun kenten ngawanan, wenten pertigaan nika ring kaja kauh.. Guna: Mm	Afterwards, to the right, there's a fork in the north west....	Sudah begitu, ke kanan, ada pertigaan itu di utara barat.. Mm
Kaurugin	https://dictionary.basabali.org/Kaurugin	https://www.youtube.com/embed/h-9RWla_qL0?	kacritayang duk sang Kebo Iwa padem, dane kaurugin olih Ida Gajah Mada antuk batu lan tanah ring sumur sane kakaryanin ring majapahit.	It was told that when Kebo Iwa died, he was buried by Gajah Mada with stones and land that had been worked on in Majapahit.	Diceritakan pada saat Kebo Iwa wafat, beliau ditimbun oleh Gajah Mada dengan batu serta tanah yang dikerjakan di Majapahit.
Kawah	https://dictionary.basabali.org/Kawah	https://www.youtube.com/embed/MGqPkW1V6-4?	O memang drika ring tengah kawah ampun wenten asap. Tanggal 19 tiang munggah muncul 4 titik asep. Setelah nika, pun kenten tanggal 29 asap nika menambah malih 4, kenten.	Yeah ... sure ... there in the centre of the crater there is smoke. On the 19th I went up and there were 4 points where smoke was coming out. After that .... on the 29th there were 4 more. That's how it was.	O memang di sana di tengah kawah sudah ada asap. Tanggal 19 saya naik muncul 4 titik asap. Setelah itu, sudah begitu tanggal 29 asap itu bertambah lagi 4, begitu.
Kawastanin	https://dictionary.basabali.org/Kawastanin	https://www.youtube.com/embed/UHVILH6QVOM?	Wih, suksma pisan, Kak! Mangkin tiang sampun uning akedik indik napi sane kawastanin yoga lan semadi.	Wow, thank you so much, Grandpa! Now i’ve learned about the meaning of yoga and meditation.	Wuih, terima kasih sekali, Kek! Sekarang saya sudah sedikit mengetahui tentang yang dinamakan yoga dan semadi.
Kawentenan	https://dictionary.basabali.org/Kawentenan	https://www.youtube.com/embed/O7TS_Vmq0sM?	Ngajanang driki, kan wenten driki…sekolah, wenten pertigaan, pertigaan nika ke kanan.	From here to the north, yes there is a....school, a fork, that fork is to the right.	Dari sini ke arah utara, kan ada di sini…sekolah, ada pertigaan, pertigaan itu ke kanan.
Kawentenan	https://dictionary.basabali.org/Kawentenan	https://www.youtube.com/embed/kTkjIsqtO5U?	Tradisi ngoncang.... Sampun kidik alit druene uning antuk kawentenan tradisi ngoncang puniki.	Ngoncang Tradition. A very few number of kids know the existence of this Ngoncang tradition.	Tradisi Ngoncang. Semakin sedikit anak-anak kita yang tahu keberadaan tradisi Ngoncang ini.
Kaweruhan	https://dictionary.basabali.org/Kaweruhan	https://www.youtube.com/embed/evkOUsUdNuo?	Nggih, wastane lontar usada taru pramana. Siosan punika taler titiang polih kaweruhan saking tetamian para leluhure sane nguni.	Yes, it’s called an herbal manuscript. I inherited the knowledge also from my ancestors.	Iya, namanya lontar ilmu pengobatan herbal. Selain itu saya juga mendapat pengetahuan dari warisan para leluhur dulu.
Kawigunane	https://dictionary.basabali.org/Kawigunane	https://www.youtube.com/embed/OYrei3SbgWs?	Sambilanga madaar ia ngenehang apa ane makada musti nguangin nganggon plastik. Yadiastun ia masih mapineh plastik ento liu kawigunane, umpamine anggon wadah bablanjan lan anggon wadah canang ri kala Purnama ka sekolah. Buina nganggon plastik liu ngaenang gaene elahan. Tusing perlu repot, disubane suud nganggon lantas entungang dogen ka tong sampahe. Kanti nasine telah, ia masih enu ngenehang unduke ento.	While she was eating, she thought of reasons why she should use less plastic … even though she thought that plastic had many uses, for example, as a bag for carrying shopping and as a container for taking offerings to school when there is a full moon. Furthermore, using plastic makes work easier. No fuss … after you have used it, you just throw it in the trash. She thought about such things all the way through her meal.	Sambil makan ia memikirkan alasan harus mengurangi penggunaan plastik. Meski menurutnya plastik itu banyak gunanya, misalnya untuk wadah barang-barang ketika berbelanja dan sebagai tempat canang ke sekolah saat Purnama. Tambahan pula, plastik membuat pekerjaan lebih mudah. Tidak perlu repot. Selesai dipakai, tinggal buang saja ke tong sampah. Sampai habis nasinya, ia masih memikirkan hal itu.
Kawitan	https://dictionary.basabali.org/Kawitan	https://www.youtube.com/embed/J1xtVuAw_K4?	Ayu: Kawitan tiange ring Padarman Kresna Kepakisan. Yoga: Oh, kenten.	Ayu: My ancestors came from Padarman Kresna Kepakisan. Yoga: Oh, really.	Ayu: Kawitan saya di Padarman Kresna Kepakisan. Yoga: Oh, begitu.
Kayang	https://dictionary.basabali.org/Kayang	https://www.youtube.com/embed/FSnT2i4VwS8?	Kayang ka jani sampun rauh undagan kaping pat belas. Men, yaning Ayu punapi satuane?	Now we're up to the fourteenth generation. So, Ayu, what is your story?	Hingga saat ini sudah sampai generasi keempat belas. Ya, kalau Ayu bagaimana ceritanya?
Kayu	https://dictionary.basabali.org/Kayu	https://www.youtube.com/embed/4OY-sTkOLAI?	Uli cenik ia suba ajahina munduhang pipis, apang ngidaang masuk ane tegeh. Buka cenik-cenikan tetani nyidaang ngebahang kayu gede.	She has been taught to save money for her higher education since childhood, like the effort of a termite that manage to befell a large timber.	Sedari kecil ia sudah diajarkan mengumpulkan uang agar bisa sekolah yang tinggi, seperti kecil-kecilnya rayap mampu menumbangkan kayu besar.
Kayu manis	https://dictionary.basabali.org/Kayu_manis	https://www.youtube.com/embed/1LR49YhQRq4?	Sira kémanten dados ngolah daun kayu manis anggén loloh, anggén nambanin kolongan sané serak mangda lebih seger, dagingin tasik miwah (peresan) juuk lengis.	Anyone can cultivate star gooseberry leaf into herbal medicine. To treat a sore throat so it feels fresher, add salt and lime juice.	Siapa saja bisa mengolah daun kayu manis menjadi jamu, digunakan untuk mengobati tenggorokan yang serak, supaya rasanya lebih segar, isila garam dan perasan jeruk nipis.
Kayu manis	https://dictionary.basabali.org/Kayu_manis	https://www.youtube.com/embed/cgCbcN4GZk4?	SERET : Munyin tiange serak liu anake ngorahin naar loloh kayu manis ane lakarnne aji don kayu manis miwah juuk nipis.	HOARSENESS: Many people told me to drink Star Gooseberry (Sauropus androgynus) leaves herb mix, which is made from Star Gooseberry leaves and key lime (Citrus aurantifolia).	SUARA SERET: Banyak orang memberitahu untuk minum minuman kayu manis yang bahanya terbuat dari daun kayu manis dan jeruk nipis
Kayu manis	https://dictionary.basabali.org/Kayu_manis	https://www.youtube.com/embed/ifs73fRs9r8?	Puniki tata titi ngaryanin loloh don kayu manis anggén nambanin panes dalam.	-	Begini caranya membuat jamu daun kayu manis/katuk untuk mengobati panas dalam.
Kayun	https://dictionary.basabali.org/Kayun	https://www.youtube.com/embed/1z-kZ7f9fL4?	Kajeng Kliwon Wengi jagate serbi Kocap leake malali ke sisi bareng lenda-lendi Gumine remrem langite surem bulan bintange merem Ngawi serem delod Pura Dalem Calon Arang kasolahang Walu Nateng Dirah kalampahang sasuunan karehang Leak barak ngajak panak kedek ngakak Kedis guak magending kaak-kaak Madaging lampah manusa pejah Sane kayun durusang tadah wangke matah Ring rurung asune nyalung aung-aung nolih I rarung Ngawinang jering bulun kalung (16 Januari 2014)	-	Kajeng Kliwon Kajeng Kliwon malam yang serbi terdapat leak yang keluar bersama lenda-lendi Bumi mendung langit buram bulan bintang tertidur membuat seram selatan Pura Dalem Calon Arang ditarikan Walu Nateng Dirah diperagakan Junjungan ditarikan Leak Merah mangajak anaknya tertawa terbahak-bahak burung gagak bernyanyi kaak kaak Terdapat tingkah laku manusia mati yang mau silakan makan itu mayat hidup Dijalan anjing-anjing mangaung aung aung melihat I Rarung membuat bulu roma berdiri.
Kayune	https://dictionary.basabali.org/Kayune	https://www.youtube.com/embed/JpDrX9a7pnk?	Alase kagalgal. Punyan-punyanan kayune telah bah.	Forests have been clearcut. Trees have been felled.	Hutan telah gundul. Pohon-pohon kayu habis dibabat.
Kayunin	https://dictionary.basabali.org/Kayunin	https://www.youtube.com/embed/rO5K5bqBpok?	Ayu: Durusang encen sane kayunin. Boni: Sane biasa manten, Mbok. Tiang ten pati demen ring toya sane bes dingin, he he.	Ayu: Please help yourself, which one would you like? Boni: Just the regular one, Sister. I don’t really like water that is too cold, he he.	Ayu: Silakan yang mana yang diinginkan? Boni: Yang biasa saja, Kak. Saya tidak terlalu senang dengan air yang terlalu dingin, he he.
Ke	https://dictionary.basabali.org/Ke	https://www.youtube.com/embed/ArEdeCUstSY?	Malih pidan Beli lakar nangkil muspa ring Pura Kawitane? Boya ke benjang jagi wenten odalan?	When do you plan to pray at the ancestor temple ? Will there be a ceremony tomorrow?	Kapan Kakak akan datang bersembahyang ke Pura Kawitan? Bukankah besok akan ada perayaan?
Ke	https://dictionary.basabali.org/Ke	https://www.youtube.com/embed/O7TS_Vmq0sM?	Ngajanang driki, kan wenten driki…sekolah, wenten pertigaan, pertigaan nika ke kanan.	From here to the north, yes there is a....school, a fork, a fork to the right.	Dari sini ke arah utara, kan ada di sini…sekolah, ada pertigaan, pertigaan itu ke kanan.
Kebes	https://dictionary.basabali.org/Kebes	https://www.youtube.com/embed/9TNXRcn9W9g?	Kanti cara cengceng kebes Memene I Made ngorahin, ngonkon ngedasin kamarne.	Despite I Made’s mother yelling at him like a rapid clashing of cracked cymbals way, I Made still didn’t clean up his room (said of a person who talks a great deal).	Hingga seperti cengceng (simbal) koyak Ibunya si Made memberitahukannya, menyuruh membersihkan kamarnya.
Kebit-kebitanga	https://dictionary.basabali.org/Kebit-kebitanga	https://www.youtube.com/embed/IUVBEMKZnls?	Lantas ajaka telu bareng-bareng mamaca ensiklopedia ento. Suba pragat baana mamaca bukune ento, makita lantas I Wayan nyemak buku len ane ada duur rak ane paling siduur. Bukune ento suba daki, buina usak brengbeng. Ngenah sajan bukune ento tusing taen apikanga. Makita lantas Luh Ayu Manik lan timpal-timpalne mamaca bukune ento. Mara kebit-kebitanga bukune ento misi gambaran ane aeng lan misi rerajahan. Jejeh ajaka papat mamaca bukune ento.	They all sat down and read the encyclopedia together. After finishing with that book, I Wayan reached for another book from the highest shelf. The book was covered in dust and tattered and clearly had never been looked after. Luh Ayu Manik and her friends all wanted to look inside it. But when they opened it, they saw that it contained scary images and sacred writings in Balinese script. They were too scared to read that book.	Mereka bertiga lalu ikut membaca ensiklopedia tersebut. Setelah selesai membaca buku itu, I Wayan lalu ingin mengambil buku lain yang ada di rak paling atas. Buku itu sudah kumal, rusak dan robek. Terlihat sekali buku itu tidak pernah dirawat. Luh Ayu Manik bersama teman-temannya ingin membaca buku itu. Setelah dibuka-buka, buku tersebut berisi gambaran yang seram dan aksara suci. Mereka berempat takut membaca buku tersebut.
Kebo	https://dictionary.basabali.org/Kebo	https://www.youtube.com/embed/iYB5B4AYiVY?	Solahne buka kebo ningeh munyin gong, dugas I Made Rai tumben nepukin pramugari di tengah pesawat terbange.	He acted like a bull hearing a sound of a gong, when I made Rai met an air stewardess in an airplane for the first time.	Tingkahnya seperti kerbau mendengar suara gong, saat Made Rai tumben melihat pramugari di dalam pesawat terbang.
Kebus	https://dictionary.basabali.org/Kebus	https://www.youtube.com/embed/M_YLnCfvLPo?	Sube duang wai Men Tami gelem kebus dingin. Diapin kebus ngilgilang, ia tusing ngoyong- ngoyong. Dilanjutkan di sini: http://dictionary.basabali.org/Kebus_-_Purwaka	For two days Men Tami had been suffering chills and fever. But despite her being sick, she didn’t rest. Continued here: http://dictionary.basabali.org/Kebus_-_Background	Sudah dua hari Men Tami sakit panas dingin. Walaupun sakit, dia tidak beristirahat. Dilanjutkan di sini: http://dictionary.basabali.org/Kebus_-_Background?setlang=id
Ked	https://dictionary.basabali.org/Ked	https://www.youtube.com/embed/AtDBEdJJZLs?	Sampun ked di Desa Selat Peken, nika kan….wenten jembatan, bendungan abuan nika,	After you are in Selat Peken village, yes...there is a bridge, a greyish dam...	Sudah sampai di Desa Selat Peken, itu, kan….ada jembatan, bendungan abuan itu
Kedis	https://dictionary.basabali.org/Kedis	https://www.youtube.com/embed/lClnIMAKoP4?	Liang kenehne Pan Kocong maan undangan ka umah Pan Gede Dana, sawireh Pan Gede Dana mula kasub aji kasugihan. Sakewala, cara kedis perite malali ka punyan bingine; payu maan ngetis nanging basangne puyung. Kanti peteng ia tusing maan yeh ning.	Pan Kocong was really excited when he got an invitation to Pan Gede Dana's house because Pan Gede Dana is well known for his prosperity. Alas, just like a sparrow in a banyan tree; it can stay in a shady tree but it's tummy is empty. Until night he did not get even any water to drink.	Senang hatinya Pak Kocong mendapat undangan ke rumah Pak Gede Dana, karena Pak Gede Dana memang terkenal dengan kekayaannya. Akan tetapi, seperti burung pipit bermain ke pohon beringin; jadinya dapat berteduh tapi perutnya kosong. Sampai malam ia tidak mendapat air bening.
Kedise	https://dictionary.basabali.org/Kedise	https://www.youtube.com/embed/rATMTpJqBmM?	Ngilangang kenyelné, murid-muridé gendang gending menék gunung. Anginné nyirsir dingin nlusup tulang. Jalan ané entasin belig, makejang ajak tragia, tusing bani macanda. Ngeléng utawi ngléwa bisa makada labuh. Demen murid-muridé ningalin dusuné. Uling ba duwur tinglis tingalina umah kramané di padukuhan. Pasihé masih ngenah uling di bongkol gunungé. Di sisin alasé enu bet, kedisé nguci sahasa ngaturang panganjali tekén murid-muridé ané teka lakar nandur taru. Neked di tengah alasé, makejang ajak tangkejut. Alasé gundul. Uling di sisi ngenah bet nanging di tengah alasé benyah.	To overcome fatigue, the students sang songs on their hike up the mountain. A cold breeze chilled them to their bones. The way was slippery and the students took care, not willing to make light of the situation. If they were to lose concentration they were liable to fall. The students were happy to see the rural environment. From above, the houses of the village were clearly visible. The sea itself was visible from the base of the mountain. On the edge of the thick, still verdant forest, birds sang as though they were communicating with the students on their way to plant trees. On arriving in the forest they were all surprised - the forest had been clear felled! From outside of the forest all appeared verdant but once inside, the forest had been devastated.	Untuk menghilangkan lelah, murid-murid itu bernyanyi dalam perjalanan mendaki gunung. Angin sepoi-sepoi terasa dingin menyusup tulang. Jalan yang dilewati licin, semua anak berhati-hati, tidak berani bercanda. Jika teledor mereka bisa jatuh. Murid-murid itu senang melihat alam pedesaan. Dari atas, terlihat jelas rumah warga di desa. Lautpun kelihatan dari kaki gunung. Di sisi hutan yang masih rimbun, burung-burung bernyanyi seakan menyapa para murid yang datang untuk menanam pohon. Sampai di dalam hutan, semuanya terkejut. Ternyata hutan gundul. Dari luar tampak rimbun, tetapi di dalam keadaan hutan hancur.
Kedongdong	https://dictionary.basabali.org/Kedongdong	https://www.youtube.com/embed/P4N-3bhowzA?	Ne madan taru kedongdong, Buah kedongdong jaen pesan	This is otaheite apple tree, otaheite apple fruit is very delicious	Ini adalah pohon Kedongdong, buah kedongdong enak sekali
Kedongdong	https://dictionary.basabali.org/Kedongdong	https://www.youtube.com/embed/qrNxvGiNhz0qrNxvGiNhz0?	Niki wenten bahan sane keanggen ngubadin berung. Niki santukan parutan taru kedongdong nyane, wenten beras barak, lan kunir. Amenike ulig taru kedongdonge miwah kunir lan campur antuk yeh beras barak punika. Sesampune campur punika, obat tradisional niki sampun dados keanggen ngubadin berung nyane.	Here are some of the materials used to overcome the ulcer wounds are as follows. This is a grater from Kedongdong tree, then water immersion of brown rice, and also turmeric. Then puree the stems of Kedongdong and turmeric and then mix it with a water of brown rice. Once mashed and mixed with brown rice water, then the traditional herb is ready to be attached to the wound.	Adapun beberapa bahan yang digunakan untuk mengatasi luka borok adalah sebagai berikut. Ini merupakan parutan dari batang buah kedongdong, kemudian air rendaman beras merah, dan juga kunyit. Kemudian haluskan batang buah kedongdong dan kunyit dan kemudian campurkan dengan rendaman air beras merah. setelah dihaluskan dan dicampur dengan air beras merah, maka ramuan obat tradisional ini siap untuk ditempelkan pada luka.
Kekeh	https://dictionary.basabali.org/Kekeh	https://www.youtube.com/embed/_BQm7gDHX-w?	Apang iraga uning sane encen watek angga sane kekeh tur uning ring kawigunan gerakan-gerakan punika.	So we know which part of our body has contractations and what's the function of each movement.	Agar kita tahu bagian anggota badan yang kaku dan mengetahui manfaat gerakan-gerakan tersebut.
Kekeh jueh	https://dictionary.basabali.org/Kekeh_jueh	https://www.youtube.com/embed/kHJc0_bVeL0?	Igelné kekeh jueh.	The dance is very stiff.	Tariannya amat kaku.
Kel	https://dictionary.basabali.org/Kel	https://www.youtube.com/embed/QjLIRu84n2s?	Tapi yen kel menuju Gunung Kawi, Pak, turun terus. Turun..wenten jembatan.	But if you want to go to Kawi Mountain, Sir, keep turning. Turn...there's a bridge.	Tapi kalau mau menuju Gunung Kawi, Pak, turun terus. Turun..ada jembatan.
Kelatlat	https://dictionary.basabali.org/Kelatlat	https://www.youtube.com/embed/KbRubXn9E3w?	Cang ngae kelatlat. Suksma. Kenapi? Kenapi....	I am making a bamboo tray. Thank you. Why? Why....	-
Kelatlat	https://dictionary.basabali.org/Kelatlat	https://www.youtube.com/embed/p-05yZ0ND9Q?	-	-	-
Kelih	https://dictionary.basabali.org/Kelih	https://www.youtube.com/embed/DvVHOlcB0Xg?	Buka magantung bok akatih, ibu ngurip tiang saking ayunan kanti kelih.	Like relies on one strand of hair, I was brought up by my mother from the cradle till adulthood.	Seperti bergantung pada sehelai rambut, Ibu menghidupi saya dari ayunan sampai dewasa.
Kelihan	https://dictionary.basabali.org/Kelihan	https://www.youtube.com/embed/zr49y_ywelo?	Pianak ane kelihan madan Ni Bawang, ane cerikan madan Ni Kesuna. Akuren ngoyong kone di desane. Sawai-wai geginane tuah maburuh ka uma.	The eldest name is Ni Bawang, the youngest name is Ni Kesuna. The husband and wife lived in the village. They worked the ricefield everyday.	Anak yang sulung bernama Ni Bawang, yang bungsu bernama Ni Kesuna. Sepasang suami istri tersebut konon tinggal di desanya. Sehari-hari pekerjaan mereka sebagai buruh di sawah.
Kelod	https://dictionary.basabali.org/Kelod	https://www.youtube.com/embed/o2off_XYEco?	..beneng kelod.. terus, Bapaké, langsung ka Gitgit.	Go straight south.. and then, Sir, you’ll go right to Gitgit.	..lurus ke selatan.. terus, Bapak, langsung ke Gitgit.
Kelod	https://dictionary.basabali.org/Kelod	https://www.youtube.com/embed/39iI7X1Szq8?	Masuk, Pak, ka selag kaja kauh...ampun kénten kelod..kelod, di kaja kauh nika ee.. terus di..di ..di perbatasan kaja kauh nika, Pak, ka kanan …péngkol ka kanan nuju Campuhan.	Go in, sir, to the northwest...you'll already be going southward, in the northwest.. keep going to the northwest border, sir, to the right, turn right toward Campuhan.	Masuk, Pak, ke sela utara barat…sudah begitu ke selatan..selatan, di utara barat itu ee.. terus di..di ..di perbatasan utara barat itu, Pak, ke kanan …belok ke kanan menuju Campuhan.
Kelor	https://dictionary.basabali.org/Kelor	https://www.youtube.com/embed/QomQ-V-RuGM?	-	-	-
Kelor	https://dictionary.basabali.org/Kelor	https://www.youtube.com/embed/nlEznNQwrTs?	Om Swastyastu. Tiang I Made Cakra saking Yayasan Konservasi Sawah Bali. Tiang lakar nyelasang akidik indik daun kelor puniki. Arence daun kelor madaging vitamin C, madaging vitamin A, kalsium, potasium, protein, lan zat besi. Don kelore puniki becik antuk kesehatan. Ring gumine niki wenten telulas soroh don kelor. Soroh sane paling becik punika don kelor soroh Moringa oleifera, sane akeh tumbuh ring Bali. Matur suksma.	May everything is good on you with the grace of God. I am I Made Cakra from Sawah Bali Conservation Foundation. I'm going to give a little explanation concerning moringa leaves. Moringa leaves are rich in vitamin C, vitamin A, calcium, potassium, and iron. Moringa leaves are nutricious. There are thirteen varieties of moringa. The best one is Moringa oleifera, that is common in Bali. Thank you.	Semoga ada dalam keadaan baik/selamat atas karunia Tuhan. Saya I Made Cakra dari Yayasan Konservasi Sawah Bali. Saya akan menjelaskan sedikit tentang daun kelor ini. Satu ranting daun kelor mengandung vitamin C, mengandung vitamin A, kalsium, potasium, protein, dan zat besi. Daun kelor ini baik bagi kesehatan. Di bumi ini ada tiga belas jenis daun kelor. Jenis yang paling baik itu daun kelor jenis Moringa oleifera, yang banyak tumbuh di Bali. Terima kasih.
Kelor	https://dictionary.basabali.org/Kelor	https://www.youtube.com/embed/wSjA1W2ps3w?	Carang taru puniki mawasta carang taru kelor. Carang taru puniki, utamanyane don ipun dados kaangge obat ring sajeroning pinungkan ring panyingakan utawi sakit mata. Don ipun raris katumbuk, kacampur antuk yeh juuk lengis, uyah arang, raris kaketelin ring panyingakan sane sungkan rikala semeng miwah sande.	This branch is called the kelor tree branch. Te kelor (moringa) leaves can be used as an eye sore treatment. The leaves of the tree are mashed, mixed with lime juice, charcoal salt, then applied as an eye drop in the morning and evening.	Cabang pohon ini bernama cabang pohon kelor. Cabang pohon ini, terutama daunnya dapat digunakan untuk obat sakit mata. Daun pohon ini ditumbuk, dicampur air jeruk nipis, garam arang, kemudian diteteskan pada mata yang sakit pada pagi dan sore.
Kema	https://dictionary.basabali.org/Kema	https://www.youtube.com/embed/DGQAPSwjVdE?	Tamu-tamu ane teke kemu dadi meli poto-poto ane pameran ditu. Nyenin potone suba payu, pipisne lakar kedum dadi dadua.	All visitors who come to the orphanage are allowed to purchase the pictures at the exhibition. After that, the money from the sale will be divided in half.	Tamu-tamu yang datang ke sana dipersilakan membeli foto-foto yang dipamerkan di sana. Jika fotonya sudah laku, uangnya akan dibagi dua.
Kemah	https://dictionary.basabali.org/Kemah	https://www.youtube.com/embed/-ZNEDwqEQ5Y?	Suud ujian tengah seméster, Luh Ayu Manik lan timpal-timpalné kémah di panepi siring.	When the midterm exam is over, Luh Ayu Manik and her friends camp on the beach.	Ketika ujian tengah semester selesai, Luh Ayu Manik bersama teman-temannya kemah di pantai.
Kembang	https://dictionary.basabali.org/Kembang	https://www.youtube.com/embed/iHtpUEKvWwc?	Ngeet don pandan harum lakar anggo kembang rampe. Yen di Klungkung, kembang rampe ento madan samsam.	Cutting pandanus leaf to make kembang rampe (shredded pandanus leaf) to be added to a canang (type of small offering). In Klungkung, kembang rampe is known as samsam.	Memotong daun pandan harum untuk dijadikan kembang rampe (diisi pada canang). Kalau di Klungkung, kembang rampe dinamakan samsam.
Kena	https://dictionary.basabali.org/Kena	https://www.youtube.com/embed/Ls8QNBPaHoE?	I Luh: Buka kenken asil padine jani, Beli? Adi: Beh, sing kena baan mastiang.	I Luh: What do you think of today’s harvest, Brother? Adi: Oh, I couldn’t predict it.	I Luh: Bagaimana sepertinya hasil padinya sekarang, Kak? Adi: Wah, tidak bisa dipastikan.
Kena	https://dictionary.basabali.org/Kena	https://www.youtube.com/embed/e03W9p-3EGc?	Yan di masane galang lan panes, nyak luung asilne. Yan nganyi di masan ujane liu masih ane usak tur bah kena angin.	When the weather is nice and sunny, the results are good. But when we harvest during the rainy season, most of the crops are ruined by being struck by the wind.	Pada waktu terang dan musim panas, mau bagus hasilnya. Kalau panen di musim hujan, banyak yang rusak dan roboh diterjang angin.
Kenak	https://dictionary.basabali.org/Kenak	https://www.youtube.com/embed/3hpt86eUbKE?	Yakti, jeg kenak pisan, panggihin tiang Beli Eka, riantukan ngarahina maurukin yoga , nggih Beli?	Really, I can see that you look so fresh, Brother Eka. Perhaps by teaching yoga, you gain that appearance, right brother?	Serius, sehat sekali saya lihat Kak Eka. Karena setiap hari mengajarkan yoga, ya Kak?
