page_title	page_url	video_url	balinese	english	indonesian
A	https://dictionary.basabali.org/A	https://www.youtube.com/embed/jZMZowqnGNs?	Boni: Lamun kenten, kacang manten icen tiang abungkus, nggih? Ayu: Oh nggih, suksma. Boni: Sareng-sareng, Mbok.	Boni: In that case, you can give me a bag of peanut, okay? Ayu: Oh sure, thank you. Boni: You are welcome, Sister.	Boni: Kalau begitu, saya diberikan saja kacang sebungkus, ya? Ayu: Oh iya, terima kasih. Boni: Sama-sama, Kak.
Aa	https://dictionary.basabali.org/Aa	https://www.youtube.com/embed/-T56ewFJkjY?	Aa..driki driki….driki, Pak, ngaleran.	Yes, here...here..Pak...go toward the north.	Aa..di sini….di sini, Pak, menuju utara.
Aa	https://dictionary.basabali.org/Aa	https://www.youtube.com/embed/d-W_0K2csNU?	Aa, uli i telun, anake suba manyi di umane ane badelodan.	Yes, since three days ago, they were harvesting at the southern rice field area.	Iya, sejak tiga hari lalu, orang sudah panen di ladang sebelah selatan.
Aasan	https://dictionary.basabali.org/Aasan	https://www.youtube.com/embed/WpZbn9Hfe38?	Aasan bungan pohé makacakan di natahé ulian ujané bales gati dibi sanja.	The falling mango flower was scattered on the yard because of heavy rain yesterday afternoon.	Remahan bunga mangga berserakan di halaman rumah karena hujan lebat kemarin sore.
Aba	https://dictionary.basabali.org/Aba	https://www.youtube.com/embed/ISCMjjCelcI?	Apa adane ento, aba satu toples dengan nestar, ditolak ajak dadongne.	What’s that about, he/she brings a jar of nestar (cookies), and grandma rejects them.	Apa namanya itu, dia bawa satu toples nestar, ditolak sama nenek.
